{
  "$schema": "http://json-schema.org/draft-07/schema#",
  "title": "Principal",
  "type": "object",
  "required": [
    "attributes",
    "display_name",
    "external_subject",
    "groups",
    "identity_provider",
    "principal_id",
    "roles",
    "schema_version",
    "tenant_id",
    "type"
  ],
  "properties": {
    "attributes": {
      "type": "object",
      "additionalProperties": {
        "type": "string"
      }
    },
    "display_name": {
      "type": "string"
    },
    "external_subject": {
      "type": "string"
    },
    "groups": {
      "type": "array",
      "items": {
        "type": "string"
      }
    },
    "identity_provider": {
      "type": "string"
    },
    "principal_id": {
      "type": "string"
    },
    "roles": {
      "type": "array",
      "items": {
        "type": "string"
      }
    },
    "schema_version": {
      "type": "string"
    },
    "tenant_id": {
      "type": "string"
    },
    "type": {
      "type": "string"
    }
  }
}
